<?xml version="1.0"?>
<!DOCTYPE Report
[
<!ELEMENT Report (General ,(Doc|BPT)) >
<!ATTLIST Report ver CDATA #REQUIRED tmZone CDATA #REQUIRED>

<!ELEMENT General ( DocLocation ) >
<!ATTLIST General productName CDATA #REQUIRED productVer CDATA #REQUIRED os CDATA #REQUIRED host CDATA #REQUIRED qcserver CDATA #IMPLIED qcproject CDATA #IMPLIED SolManSolutionId CDATA #IMPLIED SolManProjectId CDATA #IMPLIED SolManTestPlanId CDATA #IMPLIED SolManTestPackageId CDATA #IMPLIED SolManUserInfoData CDATA #IMPLIED  >

<!ELEMENT BPT (DName,Res,DVer?,TSet?,TInst?,NodeArgs,AdditionalInfo*,Doc*) >
<!ATTLIST BPT rID ID #REQUIRED >

<!ELEMENT Doc (DName,ConfName?,Res,DVer?,TSet?,TInst?,RunType?,DT?,AdditionalInfo*,Step*,DIter*,Step*,Action*,Doc*,Summary?,TestMaintenanceSummary*,NodeArgs?) >
<!ATTLIST Doc rID ID #REQUIRED type (Test|BC|BPTWrapperTest|Flow|Group|Action) "Test" productName CDATA #REQUIRED BCIter CDATA #IMPLIED >

<!ELEMENT RunType ( #PCDATA )>
<!ATTLIST RunType fmStep (False|True) "False" batch (False|True) "False" upDesc (False|True) "False" upChk (False|True) "False" upAS (False|True) "False">

<!ELEMENT DName ( #PCDATA ) >

<!ELEMENT ConfName ( #PCDATA ) >

<!ELEMENT Res ( #PCDATA ) >

<!ELEMENT AdditionalInfo (AdditionalDataName,AdditionalDataValue ) >

<!ELEMENT AdditionalDataName ( #PCDATA ) >

<!ELEMENT AdditionalDataValue ( #PCDATA ) >

<!ELEMENT DVer ( #PCDATA ) >

<!ELEMENT TSet ( #PCDATA ) >

<!ELEMENT TInst ( #PCDATA ) >

<!ELEMENT DIter (Step*,Action+,Summary?,NodeArgs)>
<!ATTLIST DIter rID ID #REQUIRED iterID CDATA #REQUIRED>

<!ELEMENT DocLocation ( #PCDATA )>

<!ELEMENT Action (AName,AIter*,(Step|HtmlStep|Action)*, Summary,ActionMaintenanceSummary*, NodeArgs ) >
<!ATTLIST Action rID ID #REQUIRED>

<!ELEMENT AIter ((Step|HtmlStep|Action)*,DataMapping?, Summary?,NodeArgs) >
<!ATTLIST AIter rID ID #REQUIRED iterID CDATA #REQUIRED isCountable (False|True) "False" >

<!ELEMENT AName ( #PCDATA ) >

<!ELEMENT TestMaintenanceSummary (ActionMaintenanceSummary*) >
<!ATTLIST TestMaintenanceSummary ObjectsAdded CDATA #REQUIRED ObjectsUpdated CDATA #REQUIRED StepsUpdated CDATA #REQUIRED StepsComments CDATA #REQUIRED><!ELEMENT ActionMaintenanceSummary (ObjectChange* ) >
<!ATTLIST ActionMaintenanceSummary Action CDATA #REQUIRED Objects CDATA #REQUIRED Updated CDATA #REQUIRED LinesTotal CDATA #REQUIRED Added CDATA #REQUIRED LinesUpdated CDATA #REQUIRED>

<!ELEMENT ObjectChange  (Hierarchy, PropertyChangeList* ) >
<!ATTLIST ObjectChange Operation CDATA #IMPLIED OriginalRepository CDATA #IMPLIED>

<!ELEMENT PropertyChangeList (PropertyDef*) >

<!ELEMENT PropertyDef (OriginalValue, NewValue) >
<!ATTLIST PropertyDef PropName CDATA #REQUIRED OriginRegularExpression (True|False) "False" NewRegularExpression (True|False) "False" AddedProperty (True|False) "False" >

<!ELEMENT OriginalValue ( #PCDATA )>

<!ELEMENT NewValue ( #PCDATA )>

<!ELEMENT Hierarchy  (ObjectName, Hierarchy*) >
<!ATTLIST Hierarchy MicClass CDATA #REQUIRED>

<!ELEMENT ObjectName  ( #PCDATA ) >

<!ELEMENT Step (Obj,Details,Time,TimeTick* ,(Step|HtmlStep|Doc)*, DataMapping?, NodeArgs) >
<!ATTLIST Step rID ID #REQUIRED retval CDATA #IMPLIED>

<!ELEMENT HtmlStep (HTML,TimeTick*,(Step|HtmlStep|Doc)*,NodeArgs) >
<!ATTLIST HtmlStep rID ID #REQUIRED >

<!ELEMENT Obj ( #PCDATA ) >
<!ATTLIST Obj plainTxt (False|True) "True">

<!ELEMENT Details ( #PCDATA ) >
<!ATTLIST Details plainTxt (False|True) "True">

<!ELEMENT Time ( #PCDATA ) >

<!ELEMENT HTML ( #PCDATA ) >

<!ELEMENT Disp ( #PCDATA ) >

<!ELEMENT TimeTick ( #PCDATA ) >

<!ELEMENT DataMapping ( DataMappedItem* )>
<!ELEMENT DataMappedItem EMPTY >
<!ATTLIST DataMappedItem dsName CDATA #REQUIRED >
<!ATTLIST DataMappedItem rowId CDATA #REQUIRED >

<!ELEMENT NodeArgs (Disp,TopPane?,BtmPane?,ExtendedInfo? )>
<!ATTLIST NodeArgs eType CDATA #REQUIRED icon CDATA #REQUIRED nRep CDATA #REQUIRED UserNote CDATA #IMPLIED filter (False|True) "True">
<!ATTLIST NodeArgs status (Passed|Failed|Done|Warning|Information) "Done">
<!ATTLIST NodeArgs iconSel CDATA #IMPLIED nType CDATA #IMPLIED MovieMarker CDATA "">
<!ATTLIST NodeArgs Source CDATA #IMPLIED SourceLine CDATA #IMPLIED StepFlowItemKey CDATA #IMPLIED >

<!ELEMENT TopPane (Path)>

<!ELEMENT BtmPane ( (Path|WR)?,ASHilite?)>
<!ATTLIST BtmPane vType CDATA "HTML">

<!ELEMENT Path ( #PCDATA ) >

<!ELEMENT ASHilite ( #PCDATA ) >

<!ELEMENT WR ( #PCDATA ) >

<!ELEMENT ExtendedInfo ( StepData ) >

<!ATTLIST ExtendedInfo StepType CDATA #REQUIRED>
<!ELEMENT DT (NodeArgs) >
<!ATTLIST DT rID ID #REQUIRED>

<!ELEMENT Summary (Param*)>
<!ATTLIST Summary sTime CDATA #IMPLIED eTime CDATA #IMPLIED passed CDATA #IMPLIED failed CDATA #IMPLIED warnings CDATA #IMPLIED retval CDATA #IMPLIED stopped (False|True) "False" >

<!ELEMENT Param (ParamName,ParamVal)+ >
<!ATTLIST Param paramInOut (In|Out) "In">

<!ELEMENT ParamName ( #PCDATA ) >

<!ELEMENT ParamVal ( #PCDATA ) >

]
>
<Report ver="2.0" tmZone="India Standard Time">
<General productName="HP Unified Functional Testing" productVer="12.01" os="Windows 7" host="HW1419"><DocLocation><![CDATA[C:\IFSAutomation\Branch_IFS_Documents_Final\Drivers\SuiteDriver]]></DocLocation></General>
<Doc rID="T1"   productName= "HP Unified Functional Testing"  >
<DName><![CDATA[SuiteDriver]]></DName>
<Res><![CDATA[Res265]]></Res>
<DT rID="T2">
<NodeArgs eType="Table" icon="2" nRep="4" filter="False" >
<Disp><![CDATA[Run-Time Data Table]]></Disp>
<BtmPane vType="Table" >
<Path><![CDATA[Default.xls]]></Path>
</BtmPane>
</NodeArgs>
</DT>
<Action rID="T3">
<AName><![CDATA[Action1]]></AName>
<Step rID="T4">
<Obj plainTxt="False" ><![CDATA[SystemUtil]]></Obj>
<Details plainTxt="False" ><![CDATA[SystemUtil]]></Details>
<Time><![CDATA[20-09-2016 - 17:07:39]]></Time>
<TimeTick>1474371459</TimeTick>
<Step rID="T5">
<Obj plainTxt="False" ><![CDATA[Run "iexplore.exe",3]]></Obj>
<Details plainTxt="False" ><![CDATA[Run "iexplore.exe",3]]></Details>
<Time><![CDATA[20-09-2016 - 17:07:39]]></Time>
<TimeTick>1474371459</TimeTick>
<NodeArgs eType="Replay" icon="4" nRep="10" status="Passed" >
<Disp><![CDATA[Run "iexplore.exe",3]]></Disp>
</NodeArgs>
</Step>
<NodeArgs eType="Replay" icon="4" nRep="9" status="Passed" >
<Disp><![CDATA[SystemUtil]]></Disp>
</NodeArgs>
</Step>
<Step rID="T6">
<Obj plainTxt="False" ><![CDATA[Login]]></Obj>
<Details plainTxt="False" ><![CDATA[Browser]]></Details>
<Time><![CDATA[20-09-2016 - 17:08:01]]></Time>
<TimeTick>1474371481</TimeTick>
<Step rID="T7">
<Obj plainTxt="False" ><![CDATA[Login.Sync]]></Obj>
<Details plainTxt="False" ><![CDATA[]]></Details>
<Time><![CDATA[20-09-2016 - 17:08:01]]></Time>
<TimeTick>1474371481</TimeTick>
<NodeArgs eType="Replay" icon="5" nRep="20" >
<Disp><![CDATA[Login.Sync]]></Disp>
</NodeArgs>
</Step>
<NodeArgs eType="Context" icon="5" nRep="19" >
<Disp><![CDATA[Login]]></Disp>
</NodeArgs>
</Step>
<Step rID="T8">
<Obj ><![CDATA[Login]]></Obj>
<Details ><![CDATA[]]></Details>
<Time><![CDATA[20-09-2016 - 17:08:01]]></Time>
<TimeTick>1474371481</TimeTick>
<NodeArgs eType="User" icon="6" nRep="21" status="Passed" >
<Disp><![CDATA[Login]]></Disp>
</NodeArgs>
</Step>
<Step rID="T9">
<Obj plainTxt="False" ><![CDATA[Login]]></Obj>
<Details plainTxt="False" ><![CDATA[Browser]]></Details>
<Time><![CDATA[20-09-2016 - 17:08:01]]></Time>
<TimeTick>1474371481</TimeTick>
<Step rID="T10">
<Obj plainTxt="False" ><![CDATA[Login]]></Obj>
<Details plainTxt="False" ><![CDATA[Page]]></Details>
<Time><![CDATA[20-09-2016 - 17:08:01]]></Time>
<TimeTick>1474371481</TimeTick>
<Step rID="T11">
<Obj plainTxt="False" ><![CDATA[TXT_user_name.Exist]]></Obj>
<Details plainTxt="False" ><![CDATA["Object exists"]]></Details>
<Time><![CDATA[20-09-2016 - 17:08:01]]></Time>
<TimeTick>1474371481</TimeTick>
<NodeArgs eType="Replay" icon="8" nRep="25" >
<Disp><![CDATA[TXT_user_name.Exist]]></Disp>
</NodeArgs>
</Step>
<Step rID="T12">
<Obj plainTxt="False" ><![CDATA[TXT_user_name.Set]]></Obj>
<Details plainTxt="False" ><![CDATA["chrisj"]]></Details>
<Time><![CDATA[20-09-2016 - 17:08:01]]></Time>
<TimeTick>1474371481</TimeTick>
<NodeArgs eType="Replay" icon="8" nRep="27" >
<Disp><![CDATA[TXT_user_name.Set]]></Disp>
</NodeArgs>
</Step>
<NodeArgs eType="Context" icon="7" nRep="24" >
<Disp><![CDATA[Login]]></Disp>
</NodeArgs>
</Step>
<NodeArgs eType="Context" icon="5" nRep="23" >
<Disp><![CDATA[Login]]></Disp>
</NodeArgs>
</Step>
<Step rID="T13">
<Obj ><![CDATA[Login]]></Obj>
<Details ><![CDATA[]]></Details>
<Time><![CDATA[20-09-2016 - 17:08:01]]></Time>
<TimeTick>1474371481</TimeTick>
<NodeArgs eType="User" icon="6" nRep="28" status="Passed" >
<Disp><![CDATA[Login]]></Disp>
</NodeArgs>
</Step>
<Step rID="T14">
<Obj plainTxt="False" ><![CDATA[Login]]></Obj>
<Details plainTxt="False" ><![CDATA[Browser]]></Details>
<Time><![CDATA[20-09-2016 - 17:08:01]]></Time>
<TimeTick>1474371481</TimeTick>
<Step rID="T15">
<Obj plainTxt="False" ><![CDATA[Login]]></Obj>
<Details plainTxt="False" ><![CDATA[Page]]></Details>
<Time><![CDATA[20-09-2016 - 17:08:01]]></Time>
<TimeTick>1474371481</TimeTick>
<Step rID="T16">
<Obj plainTxt="False" ><![CDATA[TXT_user_password.Exist]]></Obj>
<Details plainTxt="False" ><![CDATA["Object exists"]]></Details>
<Time><![CDATA[20-09-2016 - 17:08:01]]></Time>
<TimeTick>1474371481</TimeTick>
<NodeArgs eType="Replay" icon="8" nRep="32" >
<Disp><![CDATA[TXT_user_password.Exist]]></Disp>
</NodeArgs>
</Step>
<Step rID="T17">
<Obj plainTxt="False" ><![CDATA[TXT_user_password.Set]]></Obj>
<Details plainTxt="False" ><![CDATA["password"]]></Details>
<Time><![CDATA[20-09-2016 - 17:08:01]]></Time>
<TimeTick>1474371481</TimeTick>
<NodeArgs eType="Replay" icon="8" nRep="34" >
<Disp><![CDATA[TXT_user_password.Set]]></Disp>
</NodeArgs>
</Step>
<NodeArgs eType="Context" icon="7" nRep="31" >
<Disp><![CDATA[Login]]></Disp>
</NodeArgs>
</Step>
<NodeArgs eType="Context" icon="5" nRep="30" >
<Disp><![CDATA[Login]]></Disp>
</NodeArgs>
</Step>
<Step rID="T18">
<Obj ><![CDATA[Login]]></Obj>
<Details ><![CDATA[]]></Details>
<Time><![CDATA[20-09-2016 - 17:08:01]]></Time>
<TimeTick>1474371481</TimeTick>
<NodeArgs eType="User" icon="6" nRep="35" status="Passed" >
<Disp><![CDATA[Login]]></Disp>
</NodeArgs>
</Step>
<Step rID="T19">
<Obj plainTxt="False" ><![CDATA[Login]]></Obj>
<Details plainTxt="False" ><![CDATA[Browser]]></Details>
<Time><![CDATA[20-09-2016 - 17:08:01]]></Time>
<TimeTick>1474371481</TimeTick>
<Step rID="T20">
<Obj plainTxt="False" ><![CDATA[Login]]></Obj>
<Details plainTxt="False" ><![CDATA[Page]]></Details>
<Time><![CDATA[20-09-2016 - 17:08:01]]></Time>
<TimeTick>1474371481</TimeTick>
<Step rID="T21">
<Obj plainTxt="False" ><![CDATA[BTN_Log In.Exist]]></Obj>
<Details plainTxt="False" ><![CDATA["Object exists"]]></Details>
<Time><![CDATA[20-09-2016 - 17:08:01]]></Time>
<TimeTick>1474371481</TimeTick>
<NodeArgs eType="Replay" icon="9" nRep="39" >
<Disp><![CDATA[BTN_Log In.Exist]]></Disp>
</NodeArgs>
</Step>
<Step rID="T22">
<Obj plainTxt="False" ><![CDATA[BTN_Log In.Click]]></Obj>
<Details plainTxt="False" ><![CDATA[]]></Details>
<Time><![CDATA[20-09-2016 - 17:08:04]]></Time>
<TimeTick>1474371484</TimeTick>
<NodeArgs eType="Replay" icon="9" nRep="41" >
<Disp><![CDATA[BTN_Log In.Click]]></Disp>
</NodeArgs>
</Step>
<NodeArgs eType="Context" icon="7" nRep="38" >
<Disp><![CDATA[Login]]></Disp>
</NodeArgs>
</Step>
<NodeArgs eType="Context" icon="5" nRep="37" >
<Disp><![CDATA[Login]]></Disp>
</NodeArgs>
</Step>
<Step rID="T23">
<Obj ><![CDATA[Login]]></Obj>
<Details ><![CDATA[]]></Details>
<Time><![CDATA[20-09-2016 - 17:08:04]]></Time>
<TimeTick>1474371484</TimeTick>
<NodeArgs eType="User" icon="6" nRep="42" status="Passed" >
<Disp><![CDATA[Login]]></Disp>
</NodeArgs>
</Step>
<Step rID="T24">
<Obj plainTxt="False" ><![CDATA[Work Queue]]></Obj>
<Details plainTxt="False" ><![CDATA[Browser]]></Details>
<Time><![CDATA[20-09-2016 - 17:08:16]]></Time>
<TimeTick>1474371496</TimeTick>
<Step rID="T25">
<Obj plainTxt="False" ><![CDATA[Work Queue]]></Obj>
<Details plainTxt="False" ><![CDATA[Page]]></Details>
<Time><![CDATA[20-09-2016 - 17:08:16]]></Time>
<TimeTick>1474371496</TimeTick>
<Step rID="T26">
<Obj plainTxt="False" ><![CDATA[TAB _Home.Exist]]></Obj>
<Details plainTxt="False" ><![CDATA["Object exists"]]></Details>
<Time><![CDATA[20-09-2016 - 17:08:16]]></Time>
<TimeTick>1474371496</TimeTick>
<NodeArgs eType="Replay" icon="10" nRep="46" >
<Disp><![CDATA[TAB _Home.Exist]]></Disp>
</NodeArgs>
</Step>
<Step rID="T27">
<Obj plainTxt="False" ><![CDATA[Work Queue.Sync]]></Obj>
<Details plainTxt="False" ><![CDATA[]]></Details>
<Time><![CDATA[20-09-2016 - 17:08:16]]></Time>
<TimeTick>1474371496</TimeTick>
<NodeArgs eType="Replay" icon="7" nRep="48" >
<Disp><![CDATA[Work Queue.Sync]]></Disp>
</NodeArgs>
</Step>
<Step rID="T28">
<Obj plainTxt="False" ><![CDATA[TAB _Home.Exist]]></Obj>
<Details plainTxt="False" ><![CDATA["Object exists"]]></Details>
<Time><![CDATA[20-09-2016 - 17:08:19]]></Time>
<TimeTick>1474371499</TimeTick>
<NodeArgs eType="Replay" icon="10" nRep="50" >
<Disp><![CDATA[TAB _Home.Exist]]></Disp>
</NodeArgs>
</Step>
<NodeArgs eType="Context" icon="7" nRep="45" >
<Disp><![CDATA[Work Queue]]></Disp>
</NodeArgs>
</Step>
<NodeArgs eType="Context" icon="5" nRep="44" >
<Disp><![CDATA[Work Queue]]></Disp>
</NodeArgs>
</Step>
<Step rID="T29">
<Obj ><![CDATA[Login]]></Obj>
<Details ><![CDATA[]]></Details>
<Time><![CDATA[20-09-2016 - 17:08:19]]></Time>
<TimeTick>1474371499</TimeTick>
<NodeArgs eType="User" icon="6" nRep="51" status="Passed" >
<Disp><![CDATA[Login]]></Disp>
</NodeArgs>
</Step>
<Step rID="T30">
<Obj plainTxt="False" ><![CDATA[Work Queue]]></Obj>
<Details plainTxt="False" ><![CDATA[Browser]]></Details>
<Time><![CDATA[20-09-2016 - 17:08:19]]></Time>
<TimeTick>1474371499</TimeTick>
<Step rID="T31">
<Obj plainTxt="False" ><![CDATA[Work Queue]]></Obj>
<Details plainTxt="False" ><![CDATA[Page]]></Details>
<Time><![CDATA[20-09-2016 - 17:08:19]]></Time>
<TimeTick>1474371499</TimeTick>
<Step rID="T32">
<Obj plainTxt="False" ><![CDATA[TAB_Tests.Exist]]></Obj>
<Details plainTxt="False" ><![CDATA["Object exists"]]></Details>
<Time><![CDATA[20-09-2016 - 17:08:19]]></Time>
<TimeTick>1474371499</TimeTick>
<NodeArgs eType="Replay" icon="10" nRep="55" >
<Disp><![CDATA[TAB_Tests.Exist]]></Disp>
</NodeArgs>
</Step>
<Step rID="T33">
<Obj plainTxt="False" ><![CDATA[TAB_Tests.Click]]></Obj>
<Details plainTxt="False" ><![CDATA[]]></Details>
<Time><![CDATA[20-09-2016 - 17:08:22]]></Time>
<TimeTick>1474371502</TimeTick>
<NodeArgs eType="Replay" icon="10" nRep="57" >
<Disp><![CDATA[TAB_Tests.Click]]></Disp>
</NodeArgs>
</Step>
<NodeArgs eType="Context" icon="7" nRep="54" >
<Disp><![CDATA[Work Queue]]></Disp>
</NodeArgs>
</Step>
<NodeArgs eType="Context" icon="5" nRep="53" >
<Disp><![CDATA[Work Queue]]></Disp>
</NodeArgs>
</Step>
<Step rID="T34">
<Obj ><![CDATA[NavigateToSmartyStreetTesting]]></Obj>
<Details ><![CDATA[]]></Details>
<Time><![CDATA[20-09-2016 - 17:08:22]]></Time>
<TimeTick>1474371502</TimeTick>
<NodeArgs eType="User" icon="6" nRep="58" status="Passed" >
<Disp><![CDATA[NavigateToSmartyStreetTesting]]></Disp>
</NodeArgs>
</Step>
<Step rID="T35">
<Obj plainTxt="False" ><![CDATA[Work Queue]]></Obj>
<Details plainTxt="False" ><![CDATA[Browser]]></Details>
<Time><![CDATA[20-09-2016 - 17:08:22]]></Time>
<TimeTick>1474371502</TimeTick>
<Step rID="T36">
<Obj plainTxt="False" ><![CDATA[Work Queue]]></Obj>
<Details plainTxt="False" ><![CDATA[Page]]></Details>
<Time><![CDATA[20-09-2016 - 17:08:22]]></Time>
<TimeTick>1474371502</TimeTick>
<Step rID="T37">
<Obj plainTxt="False" ><![CDATA[LNK_SmartyStreetsTesting.Exist]]></Obj>
<Details plainTxt="False" ><![CDATA["Object exists"]]></Details>
<Time><![CDATA[20-09-2016 - 17:08:22]]></Time>
<TimeTick>1474371502</TimeTick>
<NodeArgs eType="Replay" icon="10" nRep="62" >
<Disp><![CDATA[LNK_SmartyStreetsTesting.Exist]]></Disp>
</NodeArgs>
</Step>
<NodeArgs eType="Context" icon="7" nRep="61" >
<Disp><![CDATA[Work Queue]]></Disp>
</NodeArgs>
</Step>
<NodeArgs eType="Context" icon="5" nRep="60" >
<Disp><![CDATA[Work Queue]]></Disp>
</NodeArgs>
</Step>
<Step rID="T38">
<Obj ><![CDATA[NavigateToSmartyStreetTesting]]></Obj>
<Details ><![CDATA[]]></Details>
<Time><![CDATA[20-09-2016 - 17:08:22]]></Time>
<TimeTick>1474371502</TimeTick>
<NodeArgs eType="User" icon="6" nRep="63" status="Passed" >
<Disp><![CDATA[NavigateToSmartyStreetTesting]]></Disp>
</NodeArgs>
</Step>
<Step rID="T39">
<Obj plainTxt="False" ><![CDATA[Work Queue]]></Obj>
<Details plainTxt="False" ><![CDATA[Browser]]></Details>
<Time><![CDATA[20-09-2016 - 17:08:22]]></Time>
<TimeTick>1474371502</TimeTick>
<Step rID="T40">
<Obj plainTxt="False" ><![CDATA[Work Queue]]></Obj>
<Details plainTxt="False" ><![CDATA[Page]]></Details>
<Time><![CDATA[20-09-2016 - 17:08:22]]></Time>
<TimeTick>1474371502</TimeTick>
<Step rID="T41">
<Obj plainTxt="False" ><![CDATA[LNK_SmartyStreetsTesting.Exist]]></Obj>
<Details plainTxt="False" ><![CDATA["Object exists"]]></Details>
<Time><![CDATA[20-09-2016 - 17:08:22]]></Time>
<TimeTick>1474371502</TimeTick>
<NodeArgs eType="Replay" icon="10" nRep="67" >
<Disp><![CDATA[LNK_SmartyStreetsTesting.Exist]]></Disp>
</NodeArgs>
</Step>
<Step rID="T42">
<Obj plainTxt="False" ><![CDATA[LNK_SmartyStreetsTesting.Click]]></Obj>
<Details plainTxt="False" ><![CDATA[]]></Details>
<Time><![CDATA[20-09-2016 - 17:08:25]]></Time>
<TimeTick>1474371505</TimeTick>
<NodeArgs eType="Replay" icon="10" nRep="69" >
<Disp><![CDATA[LNK_SmartyStreetsTesting.Click]]></Disp>
</NodeArgs>
</Step>
<NodeArgs eType="Context" icon="7" nRep="66" >
<Disp><![CDATA[Work Queue]]></Disp>
</NodeArgs>
</Step>
<NodeArgs eType="Context" icon="5" nRep="65" >
<Disp><![CDATA[Work Queue]]></Disp>
</NodeArgs>
</Step>
<Step rID="T43">
<Obj ><![CDATA[NavigateToSmartyStreetTesting]]></Obj>
<Details ><![CDATA[]]></Details>
<Time><![CDATA[20-09-2016 - 17:08:25]]></Time>
<TimeTick>1474371505</TimeTick>
<NodeArgs eType="User" icon="6" nRep="70" status="Passed" >
<Disp><![CDATA[NavigateToSmartyStreetTesting]]></Disp>
</NodeArgs>
</Step>
<Step rID="T44">
<Obj plainTxt="False" ><![CDATA[SmartyStreetsTesting]]></Obj>
<Details plainTxt="False" ><![CDATA[Browser]]></Details>
<Time><![CDATA[20-09-2016 - 17:08:41]]></Time>
<TimeTick>1474371521</TimeTick>
<Step rID="T45">
<Obj plainTxt="False" ><![CDATA[SmartyStreetsTesting]]></Obj>
<Details plainTxt="False" ><![CDATA[Page]]></Details>
<Time><![CDATA[20-09-2016 - 17:08:41]]></Time>
<TimeTick>1474371521</TimeTick>
<Step rID="T46">
<Obj plainTxt="False" ><![CDATA[LBL_LegalAddress.Exist]]></Obj>
<Details plainTxt="False" ><![CDATA["Object exists"]]></Details>
<Time><![CDATA[20-09-2016 - 17:08:41]]></Time>
<TimeTick>1474371521</TimeTick>
<NodeArgs eType="Replay" icon="10" nRep="74" >
<Disp><![CDATA[LBL_LegalAddress.Exist]]></Disp>
</NodeArgs>
</Step>
<NodeArgs eType="Context" icon="7" nRep="73" >
<Disp><![CDATA[SmartyStreetsTesting]]></Disp>
</NodeArgs>
</Step>
<NodeArgs eType="Context" icon="5" nRep="72" >
<Disp><![CDATA[SmartyStreetsTesting]]></Disp>
</NodeArgs>
</Step>
<Step rID="T47">
<Obj ><![CDATA[ValidateCorrectLater]]></Obj>
<Details ><![CDATA[]]></Details>
<Time><![CDATA[20-09-2016 - 17:08:41]]></Time>
<TimeTick>1474371521</TimeTick>
<NodeArgs eType="User" icon="6" nRep="75" status="Passed" >
<Disp><![CDATA[ValidateCorrectLater]]></Disp>
</NodeArgs>
</Step>
<Step rID="T48">
<Obj plainTxt="False" ><![CDATA[SmartyStreetsTesting]]></Obj>
<Details plainTxt="False" ><![CDATA[Browser]]></Details>
<Time><![CDATA[20-09-2016 - 17:08:41]]></Time>
<TimeTick>1474371521</TimeTick>
<Step rID="T49">
<Obj plainTxt="False" ><![CDATA[SmartyStreetsTesting]]></Obj>
<Details plainTxt="False" ><![CDATA[Page]]></Details>
<Time><![CDATA[20-09-2016 - 17:08:41]]></Time>
<TimeTick>1474371521</TimeTick>
<Step rID="T50">
<Obj plainTxt="False" ><![CDATA[TXT_LA_Address.Exist]]></Obj>
<Details plainTxt="False" ><![CDATA["Object exists"]]></Details>
<Time><![CDATA[20-09-2016 - 17:08:41]]></Time>
<TimeTick>1474371521</TimeTick>
<NodeArgs eType="Replay" icon="8" nRep="79" >
<Disp><![CDATA[TXT_LA_Address.Exist]]></Disp>
</NodeArgs>
</Step>
<Step rID="T51">
<Obj plainTxt="False" ><![CDATA[TXT_LA_Address.Set]]></Obj>
<Details plainTxt="False" ><![CDATA["722 Jetton"]]></Details>
<Time><![CDATA[20-09-2016 - 17:08:41]]></Time>
<TimeTick>1474371521</TimeTick>
<NodeArgs eType="Replay" icon="8" nRep="81" >
<Disp><![CDATA[TXT_LA_Address.Set]]></Disp>
</NodeArgs>
</Step>
<NodeArgs eType="Context" icon="7" nRep="78" >
<Disp><![CDATA[SmartyStreetsTesting]]></Disp>
</NodeArgs>
</Step>
<NodeArgs eType="Context" icon="5" nRep="77" >
<Disp><![CDATA[SmartyStreetsTesting]]></Disp>
</NodeArgs>
</Step>
<Step rID="T52">
<Obj ><![CDATA[ValidateCorrectLater]]></Obj>
<Details ><![CDATA[]]></Details>
<Time><![CDATA[20-09-2016 - 17:08:41]]></Time>
<TimeTick>1474371521</TimeTick>
<NodeArgs eType="User" icon="6" nRep="82" status="Passed" >
<Disp><![CDATA[ValidateCorrectLater]]></Disp>
</NodeArgs>
</Step>
<Step rID="T53">
<Obj plainTxt="False" ><![CDATA[SmartyStreetsTesting]]></Obj>
<Details plainTxt="False" ><![CDATA[Browser]]></Details>
<Time><![CDATA[20-09-2016 - 17:08:41]]></Time>
<TimeTick>1474371521</TimeTick>
<Step rID="T54">
<Obj plainTxt="False" ><![CDATA[SmartyStreetsTesting]]></Obj>
<Details plainTxt="False" ><![CDATA[Page]]></Details>
<Time><![CDATA[20-09-2016 - 17:08:41]]></Time>
<TimeTick>1474371521</TimeTick>
<Step rID="T55">
<Obj plainTxt="False" ><![CDATA[BTN_CorrectLater.Exist]]></Obj>
<Details plainTxt="False" ><![CDATA["Object exists"]]></Details>
<Time><![CDATA[20-09-2016 - 17:08:41]]></Time>
<TimeTick>1474371521</TimeTick>
<NodeArgs eType="Replay" icon="9" nRep="86" >
<Disp><![CDATA[BTN_CorrectLater.Exist]]></Disp>
</NodeArgs>
</Step>
<NodeArgs eType="Context" icon="7" nRep="85" >
<Disp><![CDATA[SmartyStreetsTesting]]></Disp>
</NodeArgs>
</Step>
<NodeArgs eType="Context" icon="5" nRep="84" >
<Disp><![CDATA[SmartyStreetsTesting]]></Disp>
</NodeArgs>
</Step>
<Step rID="T56">
<Obj ><![CDATA[ValidateCorrectLater]]></Obj>
<Details ><![CDATA[]]></Details>
<Time><![CDATA[20-09-2016 - 17:08:41]]></Time>
<TimeTick>1474371521</TimeTick>
<NodeArgs eType="User" icon="6" nRep="87" status="Passed" >
<Disp><![CDATA[ValidateCorrectLater]]></Disp>
</NodeArgs>
</Step>
<Step rID="T57">
<Obj plainTxt="False" ><![CDATA[SmartyStreetsTesting]]></Obj>
<Details plainTxt="False" ><![CDATA[Browser]]></Details>
<Time><![CDATA[20-09-2016 - 17:08:41]]></Time>
<TimeTick>1474371521</TimeTick>
<Step rID="T58">
<Obj plainTxt="False" ><![CDATA[SmartyStreetsTesting]]></Obj>
<Details plainTxt="False" ><![CDATA[Page]]></Details>
<Time><![CDATA[20-09-2016 - 17:08:41]]></Time>
<TimeTick>1474371521</TimeTick>
<Step rID="T59">
<Obj plainTxt="False" ><![CDATA[BTN_CorrectLater.Exist]]></Obj>
<Details plainTxt="False" ><![CDATA["Object exists"]]></Details>
<Time><![CDATA[20-09-2016 - 17:08:41]]></Time>
<TimeTick>1474371521</TimeTick>
<NodeArgs eType="Replay" icon="9" nRep="91" >
<Disp><![CDATA[BTN_CorrectLater.Exist]]></Disp>
</NodeArgs>
</Step>
<Step rID="T60">
<Obj plainTxt="False" ><![CDATA[BTN_CorrectLater.Click]]></Obj>
<Details plainTxt="False" ><![CDATA[]]></Details>
<Time><![CDATA[20-09-2016 - 17:08:44]]></Time>
<TimeTick>1474371524</TimeTick>
<NodeArgs eType="Replay" icon="9" nRep="93" >
<Disp><![CDATA[BTN_CorrectLater.Click]]></Disp>
</NodeArgs>
</Step>
<NodeArgs eType="Context" icon="7" nRep="90" >
<Disp><![CDATA[SmartyStreetsTesting]]></Disp>
</NodeArgs>
</Step>
<NodeArgs eType="Context" icon="5" nRep="89" >
<Disp><![CDATA[SmartyStreetsTesting]]></Disp>
</NodeArgs>
</Step>
<Step rID="T61">
<Obj ><![CDATA[ValidateCorrectLater]]></Obj>
<Details ><![CDATA[]]></Details>
<Time><![CDATA[20-09-2016 - 17:08:44]]></Time>
<TimeTick>1474371524</TimeTick>
<NodeArgs eType="User" icon="6" nRep="94" status="Passed" >
<Disp><![CDATA[ValidateCorrectLater]]></Disp>
</NodeArgs>
</Step>
<Step rID="T62">
<Obj plainTxt="False" ><![CDATA[SmartyStreetsTesting]]></Obj>
<Details plainTxt="False" ><![CDATA[Browser]]></Details>
<Time><![CDATA[20-09-2016 - 17:08:59]]></Time>
<TimeTick>1474371539</TimeTick>
<Step rID="T63">
<Obj plainTxt="False" ><![CDATA[SmartyStreetsTestingReadOnly]]></Obj>
<Details plainTxt="False" ><![CDATA[Page]]></Details>
<Time><![CDATA[20-09-2016 - 17:08:59]]></Time>
<TimeTick>1474371539</TimeTick>
<Step rID="T64">
<Obj plainTxt="False" ><![CDATA[RWL_LA_Address.Exist]]></Obj>
<Details plainTxt="False" ><![CDATA["Object exists"]]></Details>
<Time><![CDATA[20-09-2016 - 17:08:59]]></Time>
<TimeTick>1474371539</TimeTick>
<NodeArgs eType="Replay" icon="10" nRep="98" >
<Disp><![CDATA[RWL_LA_Address.Exist]]></Disp>
</NodeArgs>
</Step>
<NodeArgs eType="Context" icon="7" nRep="97" >
<Disp><![CDATA[SmartyStreetsTestingReadOnly]]></Disp>
</NodeArgs>
</Step>
<NodeArgs eType="Context" icon="5" nRep="96" >
<Disp><![CDATA[SmartyStreetsTesting]]></Disp>
</NodeArgs>
</Step>
<Step rID="T65">
<Obj ><![CDATA[ValidateCorrectLater]]></Obj>
<Details ><![CDATA[]]></Details>
<Time><![CDATA[20-09-2016 - 17:08:59]]></Time>
<TimeTick>1474371539</TimeTick>
<NodeArgs eType="User" icon="6" nRep="99" status="Passed" >
<Disp><![CDATA[ValidateCorrectLater]]></Disp>
</NodeArgs>
</Step>
<Step rID="T66">
<Obj plainTxt="False" ><![CDATA[SmartyStreetsTesting]]></Obj>
<Details plainTxt="False" ><![CDATA[Browser]]></Details>
<Time><![CDATA[20-09-2016 - 17:08:59]]></Time>
<TimeTick>1474371539</TimeTick>
<Step rID="T67">
<Obj plainTxt="False" ><![CDATA[SmartyStreetsTestingReadOnly]]></Obj>
<Details plainTxt="False" ><![CDATA[Page]]></Details>
<Time><![CDATA[20-09-2016 - 17:08:59]]></Time>
<TimeTick>1474371539</TimeTick>
<Step rID="T68">
<Obj plainTxt="False" ><![CDATA[RWL_LA_Address.Exist]]></Obj>
<Details plainTxt="False" ><![CDATA["Object exists"]]></Details>
<Time><![CDATA[20-09-2016 - 17:08:59]]></Time>
<TimeTick>1474371539</TimeTick>
<NodeArgs eType="Replay" icon="10" nRep="103" >
<Disp><![CDATA[RWL_LA_Address.Exist]]></Disp>
</NodeArgs>
</Step>
<NodeArgs eType="Context" icon="7" nRep="102" >
<Disp><![CDATA[SmartyStreetsTestingReadOnly]]></Disp>
</NodeArgs>
</Step>
<NodeArgs eType="Context" icon="5" nRep="101" >
<Disp><![CDATA[SmartyStreetsTesting]]></Disp>
</NodeArgs>
</Step>
<Step rID="T69">
<Obj ><![CDATA[ValidateCorrectLater]]></Obj>
<Details ><![CDATA[]]></Details>
<Time><![CDATA[20-09-2016 - 17:08:59]]></Time>
<TimeTick>1474371539</TimeTick>
<NodeArgs eType="User" icon="6" nRep="104" status="Passed" >
<Disp><![CDATA[ValidateCorrectLater]]></Disp>
</NodeArgs>
</Step>
<Step rID="T70">
<Obj plainTxt="False" ><![CDATA[SmartyStreetsTesting]]></Obj>
<Details plainTxt="False" ><![CDATA[Browser]]></Details>
<Time><![CDATA[20-09-2016 - 17:08:59]]></Time>
<TimeTick>1474371539</TimeTick>
<Step rID="T71">
<Obj plainTxt="False" ><![CDATA[SmartyStreetsTestingReadOnly]]></Obj>
<Details plainTxt="False" ><![CDATA[Page]]></Details>
<Time><![CDATA[20-09-2016 - 17:08:59]]></Time>
<TimeTick>1474371539</TimeTick>
<Step rID="T72">
<Obj plainTxt="False" ><![CDATA[RWL_LA_ValidationStatus.Exist]]></Obj>
<Details plainTxt="False" ><![CDATA["Object exists"]]></Details>
<Time><![CDATA[20-09-2016 - 17:08:59]]></Time>
<TimeTick>1474371539</TimeTick>
<NodeArgs eType="Replay" icon="10" nRep="108" >
<Disp><![CDATA[RWL_LA_ValidationStatus.Exist]]></Disp>
</NodeArgs>
</Step>
<NodeArgs eType="Context" icon="7" nRep="107" >
<Disp><![CDATA[SmartyStreetsTestingReadOnly]]></Disp>
</NodeArgs>
</Step>
<NodeArgs eType="Context" icon="5" nRep="106" >
<Disp><![CDATA[SmartyStreetsTesting]]></Disp>
</NodeArgs>
</Step>
<Step rID="T73">
<Obj ><![CDATA[ValidateCorrectLater]]></Obj>
<Details ><![CDATA[]]></Details>
<Time><![CDATA[20-09-2016 - 17:08:59]]></Time>
<TimeTick>1474371539</TimeTick>
<NodeArgs eType="User" icon="6" nRep="109" status="Passed" >
<Disp><![CDATA[ValidateCorrectLater]]></Disp>
</NodeArgs>
</Step>
<Step rID="T74">
<Obj plainTxt="False" ><![CDATA[SmartyStreetsTesting]]></Obj>
<Details plainTxt="False" ><![CDATA[Browser]]></Details>
<Time><![CDATA[20-09-2016 - 17:08:59]]></Time>
<TimeTick>1474371539</TimeTick>
<Step rID="T75">
<Obj plainTxt="False" ><![CDATA[SmartyStreetsTestingReadOnly]]></Obj>
<Details plainTxt="False" ><![CDATA[Page]]></Details>
<Time><![CDATA[20-09-2016 - 17:08:59]]></Time>
<TimeTick>1474371539</TimeTick>
<Step rID="T76">
<Obj plainTxt="False" ><![CDATA[RWL_LA_Overridden.Exist]]></Obj>
<Details plainTxt="False" ><![CDATA["Object exists"]]></Details>
<Time><![CDATA[20-09-2016 - 17:08:59]]></Time>
<TimeTick>1474371539</TimeTick>
<NodeArgs eType="Replay" icon="10" nRep="113" >
<Disp><![CDATA[RWL_LA_Overridden.Exist]]></Disp>
</NodeArgs>
</Step>
<NodeArgs eType="Context" icon="7" nRep="112" >
<Disp><![CDATA[SmartyStreetsTestingReadOnly]]></Disp>
</NodeArgs>
</Step>
<NodeArgs eType="Context" icon="5" nRep="111" >
<Disp><![CDATA[SmartyStreetsTesting]]></Disp>
</NodeArgs>
</Step>
<Step rID="T77">
<Obj ><![CDATA[ValidateCorrectLater]]></Obj>
<Details ><![CDATA[]]></Details>
<Time><![CDATA[20-09-2016 - 17:08:59]]></Time>
<TimeTick>1474371539</TimeTick>
<NodeArgs eType="User" icon="6" nRep="114" status="Passed" >
<Disp><![CDATA[ValidateCorrectLater]]></Disp>
</NodeArgs>
</Step>
<Step rID="T78">
<Obj plainTxt="False" ><![CDATA[SmartyStreetsTesting]]></Obj>
<Details plainTxt="False" ><![CDATA[Browser]]></Details>
<Time><![CDATA[20-09-2016 - 17:08:59]]></Time>
<TimeTick>1474371539</TimeTick>
<Step rID="T79">
<Obj plainTxt="False" ><![CDATA[SmartyStreetsTestingReadOnly]]></Obj>
<Details plainTxt="False" ><![CDATA[Page]]></Details>
<Time><![CDATA[20-09-2016 - 17:08:59]]></Time>
<TimeTick>1474371539</TimeTick>
<Step rID="T80">
<Obj plainTxt="False" ><![CDATA[RWL_EA_OverriddenStatus.Exist]]></Obj>
<Details plainTxt="False" ><![CDATA["Object exists"]]></Details>
<Time><![CDATA[20-09-2016 - 17:08:59]]></Time>
<TimeTick>1474371539</TimeTick>
<NodeArgs eType="Replay" icon="10" nRep="118" >
<Disp><![CDATA[RWL_EA_OverriddenStatus.Exist]]></Disp>
</NodeArgs>
</Step>
<NodeArgs eType="Context" icon="7" nRep="117" >
<Disp><![CDATA[SmartyStreetsTestingReadOnly]]></Disp>
</NodeArgs>
</Step>